{
  "version": "0.1.0",
  "foods": [
    {
      "id": "soy-chunks",
      "displayName": "Soy chunks",
      "aliases": [
        "soya chunks"
      ],
      "referenceQuantity": {
        "amount": 35,
        "unit": "g"
      },
      "nutrition": {
        "protein": 18.2,
        "carbs": 11.6,
        "fat": 0.2,
        "calories": 120.6,
        "fiber": 4.55,
        "saturatedFat": 0.0175
      },
      "proteinQuality": "complete",
      "cost": {
        "currency": "INR",
        "amount": 45,
        "forQuantity": {
          "amount": 220,
          "unit": "g"
        },
        "proteinPer100": 52,
        "totalProtein": 114.4,
        "proteinPerCurrencyUnit": 2.54,
        "proteinPer10CurrencyUnits": 25.42
      },
      "dietaryLevel": "vegetarian"
    },
    {
      "id": "milk",
      "displayName": "Milk",
      "referenceQuantity": {
        "amount": 150,
        "unit": "ml"
      },
      "nutrition": {
        "protein": 4.8,
        "carbs": 6.6,
        "fat": 4.95,
        "calories": 90.2,
        "fiber": 0,
        "saturatedFat": 2.97
      },
      "proteinQuality": "complete",
      "dietaryLevel": "vegetarian"
    },
    {
      "id": "egg-whole",
      "displayName": "Whole egg",
      "aliases": [
        "egg"
      ],
      "referenceQuantity": {
        "amount": 2,
        "unit": "count"
      },
      "nutrition": {
        "protein": 12,
        "carbs": 0,
        "fat": 11,
        "calories": 147,
        "fiber": 0,
        "saturatedFat": 3.3
      },
      "proteinQuality": "complete",
      "cost": {
        "currency": "INR",
        "amount": 130,
        "forQuantity": {
          "amount": 1500,
          "unit": "g"
        },
        "proteinPer100": 12,
        "totalProtein": 180,
        "proteinPerCurrencyUnit": 1.38,
        "proteinPer10CurrencyUnits": 13.85
      },
      "dietaryLevel": "eggetarian"
    },
    {
      "id": "bread-slice",
      "displayName": "Bread slice",
      "referenceQuantity": {
        "amount": 1,
        "unit": "slice"
      },
      "nutrition": {
        "protein": 2.4,
        "carbs": 15,
        "fat": 0.8,
        "calories": 76.8,
        "fiber": 2,
        "saturatedFat": 0.24
      },
      "dietaryLevel": "vegetarian"
    },
    {
      "id": "curd",
      "displayName": "Curd",
      "aliases": [
        "dahi"
      ],
      "referenceQuantity": {
        "amount": 150,
        "unit": "g"
      },
      "nutrition": {
        "protein": 4.5,
        "carbs": 6,
        "fat": 5.3,
        "calories": 89.3,
        "fiber": 0,
        "saturatedFat": 3.15
      },
      "proteinQuality": "complete",
      "cost": {
        "currency": "INR",
        "amount": 28,
        "forQuantity": {
          "amount": 400,
          "unit": "g"
        },
        "proteinPer100": 3.7,
        "totalProtein": 14.8,
        "proteinPerCurrencyUnit": 0.53,
        "proteinPer10CurrencyUnits": 5.29
      },
      "dietaryLevel": "vegetarian"
    },
    {
      "id": "oil-ghee",
      "displayName": "Oil or ghee",
      "aliases": [
        "oil",
        "ghee"
      ],
      "referenceQuantity": {
        "amount": 10,
        "unit": "g"
      },
      "nutrition": {
        "protein": 0,
        "carbs": 0,
        "fat": 10,
        "calories": 90,
        "fiber": 0,
        "saturatedFat": null
      },
      "dietaryLevel": "vegetarian"
    },
    {
      "id": "sugar",
      "displayName": "Sugar",
      "referenceQuantity": {
        "amount": 10,
        "unit": "g"
      },
      "nutrition": {
        "protein": 0,
        "carbs": 9.5,
        "fat": 0,
        "calories": 38,
        "fiber": 0,
        "saturatedFat": null
      },
      "dietaryLevel": "vegetarian"
    },
    {
      "id": "whey",
      "displayName": "Whey protein",
      "aliases": [
        "whey"
      ],
      "referenceQuantity": {
        "amount": 33,
        "unit": "g"
      },
      "nutrition": {
        "protein": 24.8,
        "carbs": 2.3,
        "fat": 1,
        "calories": 117.2,
        "fiber": 0,
        "saturatedFat": 0.0693
      },
      "proteinQuality": "complete",
      "cost": {
        "currency": "INR",
        "amount": 1500,
        "forQuantity": {
          "amount": 1000,
          "unit": "g"
        },
        "proteinPer100": 90,
        "totalProtein": 900,
        "proteinPerCurrencyUnit": 0.6,
        "proteinPer10CurrencyUnits": 6
      },
      "dietaryLevel": "vegetarian"
    },
    {
      "id": "nuts",
      "displayName": "Nuts",
      "referenceQuantity": {
        "amount": 15,
        "unit": "g"
      },
      "nutrition": {
        "protein": 3,
        "carbs": 3.8,
        "fat": 7.4,
        "calories": 93.2,
        "fiber": 1.35,
        "saturatedFat": 0.5145
      },
      "dietaryLevel": "vegetarian"
    },
    {
      "id": "chia",
      "displayName": "Chia",
      "referenceQuantity": {
        "amount": 100,
        "unit": "g"
      },
      "nutrition": {
        "protein": 17,
        "carbs": 42,
        "fat": 35,
        "calories": 551,
        "fiber": 34,
        "saturatedFat": 3.5
      },
      "dietaryLevel": "vegetarian"
    },
    {
      "id": "dried-fruit",
      "displayName": "Dried fruit",
      "referenceQuantity": {
        "amount": 15,
        "unit": "g"
      },
      "nutrition": {
        "protein": 0.2,
        "carbs": 10.1,
        "fat": 0.3,
        "calories": 43.5,
        "fiber": 0.75,
        "saturatedFat": 0.021
      },
      "dietaryLevel": "vegetarian"
    },
    {
      "id": "seeds",
      "displayName": "Seeds",
      "referenceQuantity": {
        "amount": 15,
        "unit": "g"
      },
      "nutrition": {
        "protein": 2.7,
        "carbs": 3.8,
        "fat": 6.9,
        "calories": 87.9,
        "fiber": 1.5,
        "saturatedFat": 0.483
      },
      "dietaryLevel": "vegetarian"
    },
    {
      "id": "paneer",
      "displayName": "Paneer",
      "referenceQuantity": {
        "amount": 50,
        "unit": "g"
      },
      "nutrition": {
        "protein": 9,
        "carbs": 0,
        "fat": 11,
        "calories": 135,
        "fiber": 0,
        "saturatedFat": 6.6
      },
      "proteinQuality": "complete",
      "cost": {
        "currency": "INR",
        "amount": 75,
        "forQuantity": {
          "amount": 200,
          "unit": "g"
        },
        "proteinPer100": 19,
        "totalProtein": 38,
        "proteinPerCurrencyUnit": 0.51,
        "proteinPer10CurrencyUnits": 5.07
      },
      "dietaryLevel": "vegetarian"
    },
    {
      "id": "sprout",
      "displayName": "Sprout",
      "aliases": [
        "moong sprout"
      ],
      "referenceQuantity": {
        "amount": 100,
        "unit": "g"
      },
      "nutrition": {
        "protein": 3,
        "carbs": 18,
        "fat": 0.5,
        "calories": 88.5,
        "fiber": 1.8,
        "saturatedFat": 0.035
      },
      "cost": {
        "currency": "INR",
        "amount": 30,
        "forQuantity": {
          "amount": 120,
          "unit": "g"
        },
        "proteinPer100": 3,
        "totalProtein": 3.6,
        "proteinPerCurrencyUnit": 0.12,
        "proteinPer10CurrencyUnits": 1.2
      },
      "dietaryLevel": "vegetarian"
    },
    {
      "id": "khakhra",
      "displayName": "Khakhra",
      "referenceQuantity": {
        "amount": 18,
        "unit": "g"
      },
      "nutrition": {
        "protein": 2.2,
        "carbs": 13,
        "fat": 2.3,
        "calories": 81.5,
        "fiber": 1.8,
        "saturatedFat": 0.234
      },
      "dietaryLevel": "vegetarian"
    },
    {
      "id": "makhana",
      "displayName": "Makhana",
      "referenceQuantity": {
        "amount": 30,
        "unit": "g"
      },
      "nutrition": {
        "protein": 4.2,
        "carbs": 21.9,
        "fat": 0.6,
        "calories": 109.8,
        "fiber": 3.9,
        "saturatedFat": 0.06
      },
      "dietaryLevel": "vegetarian"
    },
    {
      "id": "biscuit-namkeen",
      "displayName": "Biscuit or namkeen",
      "referenceQuantity": {
        "amount": 100,
        "unit": "g"
      },
      "nutrition": {
        "protein": 7,
        "carbs": 50,
        "fat": 35,
        "calories": 543,
        "fiber": 2,
        "saturatedFat": 14
      },
      "dietaryLevel": "vegetarian"
    },
    {
      "id": "peanut-butter",
      "displayName": "Peanut butter",
      "referenceQuantity": {
        "amount": 20,
        "unit": "g"
      },
      "nutrition": {
        "protein": 4.4,
        "carbs": 4.8,
        "fat": 9.9,
        "calories": 117.6,
        "fiber": null,
        "saturatedFat": null
      },
      "proteinQuality": "incomplete",
      "cost": {
        "currency": "INR",
        "amount": 378,
        "forQuantity": {
          "amount": 1000,
          "unit": "g"
        },
        "proteinPer100": 30,
        "totalProtein": 300,
        "proteinPerCurrencyUnit": 0.79,
        "proteinPer10CurrencyUnits": 7.94
      },
      "dietaryLevel": "vegetarian"
    },
    {
      "id": "almond-milk",
      "displayName": "Almond milk",
      "referenceQuantity": {
        "amount": 200,
        "unit": "ml"
      },
      "nutrition": {
        "protein": 0.8,
        "carbs": 0.8,
        "fat": 2,
        "calories": 24.5,
        "fiber": null,
        "saturatedFat": null
      },
      "dietaryLevel": "vegetarian"
    },
    {
      "id": "tofu",
      "displayName": "Tofu",
      "referenceQuantity": {
        "amount": 100,
        "unit": "g"
      },
      "nutrition": {
        "protein": 14.2,
        "carbs": null,
        "fat": null,
        "calories": 130,
        "fiber": null,
        "saturatedFat": null
      },
      "proteinQuality": "complete",
      "cost": {
        "currency": "INR",
        "amount": 70,
        "forQuantity": {
          "amount": 200,
          "unit": "g"
        },
        "proteinPer100": 14.2,
        "totalProtein": 28.4,